{
  "meta": {
    "name": "C1-C14 故事线分类预览 v0.1",
    "version": "0.1.0",
    "datasetType": "narrativeTimelineProjection",
    "projectionTarget": "baselineTimeline",
    "modelVersion": "timeline-projection-v1",
    "source": "由 data/storyline-definitions/storylines-c1-c14-v0.1.json 转写生成的基准时间轴投影数据集，用于验证故事线分类。",
    "updatedAt": "2026-06-28"
  },
  "timelineConfig": {
    "defaultStart": "2025-07-05T09:00",
    "defaultEnd": "2025-07-14T04:00"
  },
  "chapters": [
    {
      "id": "C1",
      "title": "厂门口丢失的符",
      "startAt": "2025-07-05T09:30",
      "endAt": "2025-07-07T12:20",
      "input": "本章进入的顶层故事线：电视台关系线 / 采访组三人关系线 / 大仙祠控制线 / 叶依人主视角成长线。",
      "inside": "电视台定题并配置张航远，皮革厂正面采访被老妇丢符和求助撕开裂口。",
      "output": "关联对象域：旧厂病患家庭群体 / 符纸 / 符水 / 五味体系。"
    },
    {
      "id": "C2",
      "title": "逼仄小屋里的男人",
      "startAt": "2025-07-07T16:27",
      "endAt": "2025-07-07T22:00",
      "input": "本章进入的顶层故事线：采访组三人关系线 / 电视台关系线 / 张航远个人坠落线 / 叶依人主视角成长线。",
      "inside": "采访组确认病患家庭真实困境，熊丽吸收素材并压责，张航远受挫后出现代偿式滑坡。",
      "output": "关联对象域：旧厂病患家庭群体。"
    },
    {
      "id": "C3",
      "title": "第二天的暗访",
      "startAt": "2025-07-08T07:30",
      "endAt": "2025-07-08T13:30",
      "input": "本章进入的顶层故事线：采访组三人关系线 / 张航远个人坠落线 / 叶依人主视角成长线。",
      "inside": "叶依人和张航远私下回访，老妇暴起，张航远救人受伤并用职业病判断刺中叶依人。",
      "output": "关联对象域：旧厂病患家庭群体。"
    },
    {
      "id": "C4",
      "title": "听溪茶舍的冷面",
      "startAt": "2025-07-09T01:30",
      "endAt": "2025-07-09T14:00",
      "input": "本章进入的顶层故事线：杨家近身处置线 / 叶依人主视角成长线 / 采访组三人关系线。",
      "inside": "禹树冷拆事实链，杨家近身圈把采访问题转成旧账、数据化核查和现实处置问题。",
      "output": "关联对象域：职业病证据 / 旧厂病患家庭群体。"
    },
    {
      "id": "C5",
      "title": "电视台的正式任务",
      "startAt": "2025-07-09T15:27",
      "endAt": "2025-07-10T01:00",
      "input": "本章进入的顶层故事线：电视台关系线 / 采访组三人关系线 / 杨家近身处置线 / 张航远个人坠落线。",
      "inside": "电视台正式安排一周跟进，莫妮卡让林倩入组，三人调查组形成，张航远把任务误读成正义授权。",
      "output": "关联对象域：职业病证据。"
    },
    {
      "id": "C6",
      "title": "明线采访，暗线调查",
      "startAt": "2025-07-10T09:00",
      "endAt": "2025-07-10T18:00",
      "input": "本章进入的顶层故事线：采访组三人关系线 / 叶依人主视角成长线 / 张航远个人坠落线。",
      "inside": "三人走访十一户家庭，林倩建立数据记录，张航远的直觉判断、物化和攀附心态同时暴露。",
      "output": "关联对象域：旧厂病患家庭群体 / 职业病证据。"
    },
    {
      "id": "C7",
      "title": "老吴的线索",
      "startAt": "2025-07-10T19:00",
      "endAt": "2025-07-11T02:00",
      "input": "本章进入的顶层故事线：采访组三人关系线 / 大仙祠控制线 / 张航远个人坠落线。",
      "inside": "老吴把马先生、盼姐、符纸和失踪老人连起来，采访组第一次获得大仙祠组织节点。",
      "output": "关联对象域：旧厂病患家庭群体 / 符纸 / 符水 / 五味体系。"
    },
    {
      "id": "C8",
      "title": "三页材料",
      "startAt": "2025-07-11T09:00",
      "endAt": "2025-07-11T18:00",
      "input": "本章进入的顶层故事线：采访组三人关系线 / 电视台关系线 / 杨家近身处置线。",
      "inside": "采访组向熊丽汇报，电视台限制口径；莫妮卡上山找禹树，杨家近身圈建立风险清单和事件网络分析。",
      "output": "关联对象域：三页材料 / 职业病证据 / 旧厂病患家庭群体。"
    },
    {
      "id": "C9",
      "title": "马三魁登场",
      "startAt": "2025-07-11T19:30",
      "endAt": "2025-07-12T23:30",
      "input": "本章进入的顶层故事线：大仙祠控制线 / 采访组三人关系线 / 叶依人主视角成长线。",
      "inside": "三人深入大仙祠法会，马三魁把真实苦难、维权失败和大仙庇护包装成仪式控制。",
      "output": "关联对象域：旧厂病患家庭群体 / 符纸 / 符水 / 五味体系。"
    },
    {
      "id": "C10",
      "title": "大仙祠后夜",
      "startAt": "2025-07-13T00:00",
      "endAt": "2025-07-13T03:30",
      "input": "本章进入的顶层故事线：采访组三人关系线 / 大仙祠控制线 / 张航远个人坠落线 / 杨家近身处置线 / 叶依人主视角成长线。",
      "inside": "法会后三人分流，林盼儿进入张航远私人空间，叶依人与莫妮卡复盘马三魁并非全假，而是拿真实苦难做控制。",
      "output": "关联对象域：符纸 / 符水 / 五味体系。"
    },
    {
      "id": "C11",
      "title": "那种地方，她们进不去",
      "startAt": "2025-07-13T10:00",
      "endAt": "2025-07-13T16:30",
      "input": "本章进入的顶层故事线：叶依人主视角成长线 / 大仙祠控制线 / 杨家近身处置线 / 城市资源与慈善旧改线。",
      "inside": "叶依人通过林盼儿理解老李一家和慈善晚宴门槛，决定准时进入上层场域。",
      "output": "关联对象域：旧厂病患家庭群体。"
    },
    {
      "id": "C12",
      "title": "慈善晚宴的路径",
      "startAt": "2025-07-13T18:00",
      "endAt": "2025-07-13T21:30",
      "input": "本章进入的顶层故事线：城市资源与慈善旧改线 / 叶依人主视角成长线 / 杨家近身处置线。",
      "inside": "叶依人把病患救助转译成病历、档案、补助、转介和照护路径，钢铁主席提出旧社区失能家庭专项援助入口。",
      "output": "关联对象域：旧厂病患家庭群体 / 旧社区失能家庭专项基金。"
    },
    {
      "id": "C13",
      "title": "楼上内场与五比五",
      "startAt": "2025-07-13T21:30",
      "endAt": "2025-07-14T01:00",
      "input": "本章进入的顶层故事线：杨氏家族权力交锋线 / 城市资源与慈善旧改线 / 叶依人主视角成长线。",
      "inside": "楼上内场把旧社区改造、资金、舆论口径和裁决票绑在一起，五比五后钢铁主席把风险推给叶依人。",
      "output": "关联对象域：裁决票 / 旧社区失能家庭专项基金 / 旧厂病患家庭群体。"
    },
    {
      "id": "C14",
      "title": "会后吸收 / 一次认栽",
      "startAt": "2025-07-14T01:00",
      "endAt": "2025-07-14T03:00",
      "input": "本章进入的顶层故事线：叶依人主视角成长线 / 杨氏家族权力交锋线 / 城市资源与慈善旧改线 / 杨家近身处置线。",
      "inside": "叶依人接招，先逼各方承认筛查、基金、救助、转介、暂缓清退和媒体口径条件，再按下暂缓票，莫妮卡截断后续羞辱。",
      "output": "关联对象域：裁决票 / 旧社区失能家庭专项基金 / 旧厂病患家庭群体。"
    }
  ],
  "characters": {
    "ye_yiren": {
      "name": "叶依人",
      "short": "叶",
      "color": "#087268",
      "soft": "#e0f0ed"
    },
    "zhang_hangyuan": {
      "name": "张航远",
      "short": "张",
      "color": "#b42b40",
      "soft": "#f3d7de"
    },
    "lin_qian": {
      "name": "林倩",
      "short": "林",
      "color": "#a66a10",
      "soft": "#f3e4c8"
    },
    "monica": {
      "name": "莫妮卡",
      "short": "莫",
      "color": "#315f83",
      "soft": "#dbe8f1"
    },
    "yushu": {
      "name": "禹树",
      "short": "禹",
      "color": "#6b4f86",
      "soft": "#e9e1f0"
    },
    "yang_xinrui": {
      "name": "杨心蕊",
      "short": "杨",
      "color": "#8a6f22",
      "soft": "#efe8cf"
    },
    "lao_lin": {
      "name": "老林",
      "short": "林",
      "color": "#6f7d79",
      "soft": "#e7ecea"
    },
    "xiong_li": {
      "name": "熊丽",
      "short": "熊",
      "color": "#536761",
      "soft": "#edf2f0"
    },
    "zhou_qiheng": {
      "name": "周启衡",
      "short": "周",
      "color": "#315f83",
      "soft": "#dbe8f1"
    },
    "ma_sankui": {
      "name": "马三魁",
      "short": "马",
      "color": "#6a4c93",
      "soft": "#e7e2ef"
    },
    "lin_paner": {
      "name": "林盼儿",
      "short": "盼",
      "color": "#7a4f68",
      "soft": "#eadfe5"
    },
    "lao_wu": {
      "name": "老吴",
      "short": "吴",
      "color": "#6f7d79",
      "soft": "#e7ecea"
    },
    "lao_li_family": {
      "name": "老李一家",
      "short": "李",
      "color": "#6f7d79",
      "soft": "#e7ecea"
    },
    "patient_family_rep": {
      "name": "病患家属代表",
      "short": "病",
      "color": "#6f7d79",
      "soft": "#e7ecea"
    },
    "tv_authorizer": {
      "name": "电视台相关授权者",
      "short": "台",
      "color": "#315f83",
      "soft": "#dbe8f1"
    },
    "family_owner_rep": {
      "name": "家主系代表",
      "short": "主",
      "color": "#7b1f1f",
      "soft": "#f1d7d7"
    },
    "second_branch_media": {
      "name": "二房传媒线",
      "short": "二",
      "color": "#7b1f1f",
      "soft": "#f1d7d7"
    },
    "shen_yanqing": {
      "name": "沈砚清",
      "short": "沈",
      "color": "#7b1f1f",
      "soft": "#f1d7d7"
    },
    "steel_chair": {
      "name": "钢铁主席",
      "short": "钢",
      "color": "#a66a10",
      "soft": "#f3e4c8"
    },
    "vice_director": {
      "name": "副局长",
      "short": "局",
      "color": "#a66a10",
      "soft": "#f3e4c8"
    },
    "foundation_rep": {
      "name": "基金会代表",
      "short": "基",
      "color": "#a66a10",
      "soft": "#f3e4c8"
    },
    "real_estate_rep": {
      "name": "地产代表",
      "short": "地",
      "color": "#a66a10",
      "soft": "#f3e4c8"
    },
    "finance_rep": {
      "name": "金融代表",
      "short": "金",
      "color": "#a66a10",
      "soft": "#f3e4c8"
    },
    "energy_rep": {
      "name": "能源代表",
      "short": "能",
      "color": "#a66a10",
      "soft": "#f3e4c8"
    },
    "council_rep": {
      "name": "议员代表",
      "short": "议",
      "color": "#a66a10",
      "soft": "#f3e4c8"
    }
  },
  "tracks": [
    {
      "id": "main",
      "name": "故事主轴",
      "sub": "阶段块总览",
      "expanded": false,
      "characters": [],
      "color": "#4f625d",
      "soft": "#dfe3e2"
    },
    {
      "id": "yiren_pov",
      "name": "叶依人主视角成长线",
      "sub": "叶依人",
      "expanded": false,
      "characters": [
        "ye_yiren",
        "monica",
        "zhang_hangyuan",
        "lin_qian",
        "yushu",
        "lin_paner"
      ],
      "color": "#087268",
      "soft": "#d3e6e4"
    },
    {
      "id": "investigation_team",
      "name": "采访组三人关系线",
      "sub": "叶依人 / 张航远 / 林倩",
      "expanded": false,
      "characters": [
        "ye_yiren",
        "zhang_hangyuan",
        "lin_qian"
      ],
      "color": "#0f766e",
      "soft": "#d4e6e5"
    },
    {
      "id": "tv_media_power",
      "name": "电视台关系线",
      "sub": "熊丽 / 叶依人 / 张航远",
      "expanded": false,
      "characters": [
        "xiong_li",
        "ye_yiren",
        "zhang_hangyuan",
        "zhou_qiheng",
        "tv_authorizer"
      ],
      "color": "#315f83",
      "soft": "#dae2e9"
    },
    {
      "id": "yang_inner_circle",
      "name": "杨家近身处置线",
      "sub": "莫妮卡 / 叶依人 / 林倩",
      "expanded": false,
      "characters": [
        "monica",
        "ye_yiren",
        "lin_qian",
        "yang_xinrui",
        "lao_lin",
        "yushu"
      ],
      "color": "#6d4c41",
      "soft": "#e5dfdd"
    },
    {
      "id": "yang_clan_power",
      "name": "杨氏家族权力交锋线",
      "sub": "家主系代表 / 二房传媒线 / 周启衡",
      "expanded": false,
      "characters": [
        "family_owner_rep",
        "second_branch_media",
        "zhou_qiheng",
        "shen_yanqing",
        "steel_chair",
        "monica",
        "ye_yiren"
      ],
      "color": "#7b1f1f",
      "soft": "#e7d7d7"
    },
    {
      "id": "daxian_control",
      "name": "大仙祠控制线",
      "sub": "马三魁 / 林盼儿 / 老吴",
      "expanded": false,
      "characters": [
        "ma_sankui",
        "lin_paner",
        "lao_wu",
        "lao_li_family",
        "patient_family_rep",
        "zhang_hangyuan",
        "ye_yiren"
      ],
      "color": "#6a4c93",
      "soft": "#e4dfec"
    },
    {
      "id": "zhang_fall",
      "name": "张航远个人坠落线",
      "sub": "张航远",
      "expanded": false,
      "characters": [